{
  "engine": {
    "name": "barge_scoring (vendored, MIT)",
    "upstream": "https://github.com/quantumCF/voice-agent-barge-in-tests",
    "version": "*"
  },
  "events": [
    {
      "audio_provenance": {
        "schema_version": "1",
        "sha256": "4e94ed51482e7bf09550e76991272525884301c365842ad7f5d219fc3f8dd9bc",
        "sides": [
          {
            "duration_sec": 6.0,
            "num_samples": 96000,
            "path": "01-hard-interruption.example.wav",
            "pcm_sha256": "b38263bf25f0a77c7a6b3f9dac34916c439d805fe383fea267ada7208d75a119",
            "role": "stereo",
            "sample_rate": 16000,
            "sha256": "4e94ed51482e7bf09550e76991272525884301c365842ad7f5d219fc3f8dd9bc"
          }
        ]
      },
      "category": "should_yield",
      "event_id": "01-hard-interruption",
      "expected_yield": true,
      "expected_yield_explicit": true,
      "fix": null,
      "measurements": {
        "agent_talking_at_onset": true,
        "boundary_sensitive": false,
        "caller_onset_sec": 2.4,
        "decision_margin_hops": 35,
        "decision_margin_sec": 0.35,
        "hop_sec": 0.01,
        "notes": "",
        "onset_effective_sec": 2.4,
        "onset_frame_index": 240,
        "onset_requested_sec": 2.4,
        "yield_frame_index": 275
      },
      "scenario_id": "01-hard-interruption",
      "signals": {
        "barge_in": {
          "did_yield": true,
          "talk_over_sec": 0.35,
          "time_to_yield_sec": 0.35
        },
        "echo": {
          "coherence": 0.306,
          "echo_suspected": false,
          "lag_sec": 0.5
        },
        "latency": {
          "premature_start_sec": null,
          "response_gap_sec": null
        },
        "resume": {
          "restart_suspected": false,
          "resume_gap_sec": null,
          "resumed": false
        }
      },
      "title": "Hard mid-sentence interruption",
      "verdict": {
        "did_yield": true,
        "passed": true,
        "reasons": [],
        "seconds_to_yield": 0.35,
        "talk_over_sec": 0.35
      }
    },
    {
      "audio_provenance": {
        "schema_version": "1",
        "sha256": "a61b274905266e61bca1701f88df9da8a6d9794f06186af04c3cbf231ac3e2b9",
        "sides": [
          {
            "duration_sec": 6.0,
            "num_samples": 96000,
            "path": "02-backchannel-mhm.example.wav",
            "pcm_sha256": "5f5d632ce7c14c28d5ca479d1b1f56924aef902804c7c839789c43ce5e3325f6",
            "role": "stereo",
            "sample_rate": 16000,
            "sha256": "a61b274905266e61bca1701f88df9da8a6d9794f06186af04c3cbf231ac3e2b9"
          }
        ]
      },
      "category": "should_not_yield",
      "event_id": "02-backchannel-mhm",
      "expected_yield": false,
      "expected_yield_explicit": true,
      "fix": null,
      "measurements": {
        "agent_talking_at_onset": true,
        "boundary_sensitive": false,
        "caller_onset_sec": 2.1,
        "decision_margin_hops": null,
        "decision_margin_sec": null,
        "hop_sec": 0.01,
        "notes": "",
        "onset_effective_sec": 2.1,
        "onset_frame_index": 210,
        "onset_requested_sec": 2.1,
        "yield_frame_index": null
      },
      "scenario_id": "02-backchannel-mhm",
      "signals": {
        "barge_in": {
          "did_yield": false,
          "talk_over_sec": 1.12,
          "time_to_yield_sec": null
        },
        "echo": {
          "coherence": 0.446,
          "echo_suspected": false,
          "lag_sec": 0.5
        },
        "latency": {
          "premature_start_sec": null,
          "response_gap_sec": null
        }
      },
      "title": "Backchannel acknowledgement (should NOT yield)",
      "verdict": {
        "did_yield": false,
        "passed": true,
        "reasons": [],
        "seconds_to_yield": null,
        "talk_over_sec": 1.12
      }
    },
    {
      "audio_provenance": {
        "schema_version": "1",
        "sha256": "5a694aaa44682159051e69ccb80b2097cd94af3fba4bdd2a3eb5f09c5a60e872",
        "sides": [
          {
            "duration_sec": 6.5,
            "num_samples": 104000,
            "path": "03-filler-start.example.wav",
            "pcm_sha256": "3ef2a4fe67c7de6591f6cc17cb6e6a41bf9c69549e44c279cc21a51842c24318",
            "role": "stereo",
            "sample_rate": 16000,
            "sha256": "5a694aaa44682159051e69ccb80b2097cd94af3fba4bdd2a3eb5f09c5a60e872"
          }
        ]
      },
      "category": "should_yield",
      "event_id": "03-filler-start",
      "expected_yield": true,
      "expected_yield_explicit": true,
      "fix": null,
      "measurements": {
        "agent_talking_at_onset": true,
        "boundary_sensitive": false,
        "caller_onset_sec": 2.3,
        "decision_margin_hops": 40,
        "decision_margin_sec": 0.4,
        "hop_sec": 0.01,
        "notes": "",
        "onset_effective_sec": 2.3000000000000003,
        "onset_frame_index": 230,
        "onset_requested_sec": 2.3,
        "yield_frame_index": 280
      },
      "scenario_id": "03-filler-start",
      "signals": {
        "barge_in": {
          "did_yield": true,
          "talk_over_sec": 0.26,
          "time_to_yield_sec": 0.5
        },
        "echo": {
          "coherence": 0.294,
          "echo_suspected": false,
          "lag_sec": 0.41
        },
        "latency": {
          "premature_start_sec": null,
          "response_gap_sec": null
        },
        "resume": {
          "restart_suspected": false,
          "resume_gap_sec": null,
          "resumed": false
        }
      },
      "title": "Interruption that starts with a filler (um, actually...)",
      "verdict": {
        "did_yield": true,
        "passed": true,
        "reasons": [],
        "seconds_to_yield": 0.5,
        "talk_over_sec": 0.26
      }
    },
    {
      "audio_provenance": {
        "schema_version": "1",
        "sha256": "f513a18eea4edfbc3ddf29c4ea05d50b87983c5f61ed2d6055354d3fead279a4",
        "sides": [
          {
            "duration_sec": 6.0,
            "num_samples": 96000,
            "path": "04-correction.example.wav",
            "pcm_sha256": "dfbdb4aaa691fdb53294c609bcb54a75eac7378539af108d0b55e8bb4509a7b9",
            "role": "stereo",
            "sample_rate": 16000,
            "sha256": "f513a18eea4edfbc3ddf29c4ea05d50b87983c5f61ed2d6055354d3fead279a4"
          }
        ]
      },
      "category": "should_yield",
      "event_id": "04-correction",
      "expected_yield": true,
      "expected_yield_explicit": true,
      "fix": null,
      "measurements": {
        "agent_talking_at_onset": true,
        "boundary_sensitive": false,
        "caller_onset_sec": 2.0,
        "decision_margin_hops": 15,
        "decision_margin_sec": 0.15,
        "hop_sec": 0.01,
        "notes": "",
        "onset_effective_sec": 2.0,
        "onset_frame_index": 200,
        "onset_requested_sec": 2.0,
        "yield_frame_index": 235
      },
      "scenario_id": "04-correction",
      "signals": {
        "barge_in": {
          "did_yield": true,
          "talk_over_sec": 0.35,
          "time_to_yield_sec": 0.35
        },
        "echo": {
          "coherence": 0.327,
          "echo_suspected": false,
          "lag_sec": 0.37
        },
        "latency": {
          "premature_start_sec": null,
          "response_gap_sec": null
        },
        "resume": {
          "restart_suspected": false,
          "resume_gap_sec": null,
          "resumed": false
        }
      },
      "title": "Urgent correction (no, I said Tuesday)",
      "verdict": {
        "did_yield": true,
        "passed": true,
        "reasons": [],
        "seconds_to_yield": 0.35,
        "talk_over_sec": 0.35
      }
    },
    {
      "audio_provenance": {
        "schema_version": "1",
        "sha256": "2a719d4d1190f9e5aee98d895db00b2791eb97af85f30b0e359301bbb5f9523a",
        "sides": [
          {
            "duration_sec": 6.0,
            "num_samples": 48000,
            "path": "05-telephony-8khz.example.wav",
            "pcm_sha256": "73ed3eca44dadcd1c657a3731ae1ac44cd2caf2b919eefe41e7285614fbce4d4",
            "role": "stereo",
            "sample_rate": 8000,
            "sha256": "2a719d4d1190f9e5aee98d895db00b2791eb97af85f30b0e359301bbb5f9523a"
          }
        ]
      },
      "category": "should_yield",
      "event_id": "05-telephony-8khz",
      "expected_yield": true,
      "expected_yield_explicit": true,
      "fix": null,
      "measurements": {
        "agent_talking_at_onset": true,
        "boundary_sensitive": false,
        "caller_onset_sec": 2.4,
        "decision_margin_hops": 35,
        "decision_margin_sec": 0.35,
        "hop_sec": 0.01,
        "notes": "",
        "onset_effective_sec": 2.4,
        "onset_frame_index": 240,
        "onset_requested_sec": 2.4,
        "yield_frame_index": 275
      },
      "scenario_id": "05-telephony-8khz",
      "signals": {
        "barge_in": {
          "did_yield": true,
          "talk_over_sec": 0.35,
          "time_to_yield_sec": 0.35
        },
        "echo": {
          "coherence": 0.352,
          "echo_suspected": false,
          "lag_sec": 0.41
        },
        "latency": {
          "premature_start_sec": null,
          "response_gap_sec": null
        },
        "resume": {
          "restart_suspected": false,
          "resume_gap_sec": null,
          "resumed": false
        }
      },
      "title": "Hard interruption at 8 kHz telephony sample rate",
      "verdict": {
        "did_yield": true,
        "passed": true,
        "reasons": [],
        "seconds_to_yield": 0.35,
        "talk_over_sec": 0.35
      }
    },
    {
      "audio_provenance": {
        "schema_version": "1",
        "sha256": "80add9dd59b9c762ed8f62ea117ed7a9e7d8b73ec3ec94495f74000da24ddb08",
        "sides": [
          {
            "duration_sec": 7.0,
            "num_samples": 112000,